{
  "$schema": "http://json-schema.org/draft-07/schema#",
  "title": "OMI Visual-Source Enriched Blueprint (outsystems-ui-design projection)",
  "x_omi_reference": {
    "source": "skills/outsystems-mentor-implementation/references/odc-visual-source-enriched-blueprint.md",
    "asset": "skills/outsystems-mentor-implementation/assets/visual-source-enriched-blueprint.json",
    "harvested": "2026-07-13",
    "note": "Mechanical projection of the OMI contract. OMI's reference doc is the semantic authority; on conflict, fix this schema, never OMI."
  },
  "type": "object",
  "required": ["schema_version", "name", "description", "primary_color", "target_context", "evidence_boundary", "app_chrome", "blocks", "design_system", "entities", "screens", "icon_mapping", "roles", "acceptance_checklist"],
  "properties": {
    "schema_version": {"type": "string", "enum": ["2"]},
    "name": {"type": "string"},
    "description": {"type": "string"},
    "primary_color": {"type": "string"},
    "target_context": {
      "type": "object",
      "required": ["target_mode", "readable_app_name", "canonical_app_key", "verified_shell_required", "existing_assets", "target_surfaces", "review_notes"],
      "properties": {
        "target_mode": {"type": "string", "enum": ["existing-app", "verified blank shell", "shell-first scaffold"]},
        "readable_app_name": {"type": "string"},
        "canonical_app_key": {"type": "string"},
        "verified_shell_required": {"type": "boolean"},
        "existing_assets": {"type": "array", "items": {"type": "string"}},
        "target_surfaces": {"type": "array", "items": {"type": "string"}},
        "review_notes": {"type": "array", "items": {"type": "string"}}
      }
    },
    "evidence_boundary": {
      "type": "object",
      "required": ["evidence_status", "grounding_notes", "review_notes"],
      "properties": {
        "evidence_status": {"type": "string"},
        "grounding_notes": {"type": "array", "items": {"type": "string"}},
        "review_notes": {"type": "array", "items": {"type": "string"}}
      }
    },
    "app_chrome": {
      "type": "object",
      "required": ["layout_block"],
      "properties": {
        "layout_block": {"type": "string"}
      }
    },
    "blocks": {
      "type": "array",
      "items": {"type": "object", "required": ["name", "description"]}
    },
    "design_system": {
      "type": "object",
      "required": ["colors", "typography", "visual_rules"]
    },
    "entities": {
      "type": "array",
      "items": {
        "type": "object",
        "required": ["name", "type", "attributes"],
        "properties": {
          "name": {"type": "string"},
          "type": {"type": "string"},
          "exists": {"type": "boolean", "description": "Optional existing-asset binding: this entity is already in the target app, so its attributes are the shape to VERIFY, not to create. Valid only under target_mode 'existing-app'. Absent means create (the default)."},
          "records": {"type": "array", "items": {"type": "string"}},
          "attributes": {
            "type": "array",
            "items": {
              "type": "object",
              "required": ["name", "data_type", "is_primary_key", "is_foreign_key", "enum_values"],
              "properties": {
                "name": {"type": "string"},
                "data_type": {
                  "oneOf": [
                    {"enum": [
                      "Binary Data", "Boolean", "Currency", "Date", "Date Time",
                      "Decimal", "Email", "Integer", "Long Integer",
                      "Phone Number", "Text", "Time",
                      "binaryData", "boolean", "currency", "date", "dateTime",
                      "decimal", "email", "integer", "longInteger",
                      "phoneNumber", "text", "time",
                      "integerIdentifier", "longIntegerIdentifier",
                      "platformDefaultIdentifier"
                    ]},
                    {"type": "string", "pattern": "^[Tt]ext\\([1-9][0-9]*\\)$"},
                    {"type": "string", "pattern": "^[A-Za-z][A-Za-z0-9_]* Identifier$"}
                  ],
                  "description": "CLOSED VOCABULARY. An open string here is unvalidatable and the failure it hides is a certain publish failure, not a style slip: the model API accepts any string as an entity-attribute DataType, validation checks shape rather than membership in the platform's closed enum, and the enum is only enforced by the publish-time migration-script generator (OS-RDBS-GEN-40002, masked as OS-DPL-50203). Three admitted forms. (1) A basic type, in either of the two registers measurably in circulation - the ODC literal names from the docs (Text, Long Integer, Date Time), which OMI's contract prose and tests write, or this skill's camelCase spelling of the same twelve types, which its own fixtures write; plus the three identifier tokens in circulation. (2) A Text with its length, Text(200) - odc-studio-language-elements.md requires stating it, because an unstated length silently chooses 50 and truncates. (3) The relationship form '<TargetEntity> Identifier', single-token entity name. NOT members: the seven App Generator VirtualTypeKind values with no ODC basic type (url, percentage, rating, imageUrl, multiLineText, foreignKey, and foreignKey's spec-level kin), and near-miss spellings such as DateTime for Date Time, which are read as a Text attribute named after a type. The bare strings 'Identifier', 'Integer Identifier', 'Long Integer Identifier' and 'Text Identifier' have the shape of form (3) but are rejected by the validator: all four validate cleanly and then fail every publish."
                },
                "is_primary_key": {"type": "boolean"},
                "is_foreign_key": {"type": "boolean"},
                "enum_values": {
                  "type": ["array", "null"],
                  "items": {"type": "string"},
                  "description": "Required on every attribute. null on a plain attribute; on a foreign key pointing at a static entity, the ordered list of that entity's record names, which seeds the target when it has no entities[] entry of its own."
                }
              }
            }
          }
        }
      }
    },
    "screens": {
      "type": "array",
      "items": {
        "type": "object",
        "required": ["name", "type", "description", "main_content"],
        "properties": {
          "name": {"type": "string"},
          "render_gate": {
            "type": "array",
            "description": "Optional, and the ONE gate-bearing channel for a runtime claim. Each entry is a named assertion a render gate can execute, or an explicit declaration that no assertion is derivable. This is where a disclosure about what the screen must SHOW stops being prose: the acceptance_checklist stays advisory by design, so a claim that must be checked belongs here, exactly as an enforced count belongs in the screen's `assertions` object. SKILL-LOCAL EXTENSION, added 2026-08-30: the OMI contract this file projects does not carry this key and ignores it, exactly as it ignores `assertions`. It is per-screen and optional so the divergence stays bounded - the top-level `required` list is untouched, and a blueprint without it is the same artifact it was before. Cross-field rules the shape cannot express are in scripts/validate_blueprint.py.",
            "items": {
              "type": "object",
              "required": ["label", "assert"],
              "properties": {
                "label": {"type": "string", "description": "Names the gate row. Unique across the blueprint, because a disclosure references it by this name alone."},
                "assert": {
                  "type": "string",
                  "enum": ["widget", "populated", "text", "known-unverified"],
                  "description": "widget: the element is present. populated: it carries some value. text: it displays THIS content - the only one that can fail on a placeholder, since a placeholder is not empty. known-unverified: no assertion is derivable and the reason is stated rather than left unsaid."
                },
                "selector": {"type": "string", "description": "CSS. Required on widget/populated/text; forbidden on known-unverified. An empty string is the honest 'no confident selector' - the gate records that screenshot-only."},
                "contains": {"type": "string", "description": "text only, exclusive with equals: a fragment the displayed text must carry. Case-insensitive at the gate."},
                "equals": {"type": "string", "description": "text only, exclusive with contains: the exact displayed text. Case-sensitive at the gate."},
                "reason": {"type": "string", "description": "known-unverified only: why no assertion is derivable. Must name a token the blueprint already declares - a requirement id, a screen, a region or an entity - so a coverage hole is stated in terms of what it leaves uncovered."},
                "discharges": {"type": "array", "items": {"type": "string"}, "description": "Requirement ids this entry answers (BR-SC-006, UC-005). The link a reviewer follows from a cited requirement to the check that covers it."}
              }
            }
          },
          "main_content": {
            "type": "array",
            "items": {
              "type": "object",
              "properties": {
                "reuse": {
                  "type": "object",
                  "description": "Optional existing-asset binding: this region IS an app-local block the target app already has. `block` names the asset and may be flow-qualified ('MainFlow/RecentQueriesPanel'), unlike the bare catalog token in outsystems_hints.block. Satisfies the Block Mapping Gate on its own and must not coexist with outsystems_hints.block or custom_block_needed. Valid only under target_mode 'existing-app'.",
                  "properties": {"block": {"type": "string"}}
                },
                "items": {
                  "type": "array",
                  "description": "Children of a group region. Each item is itself a region and may carry the same optional `reuse` binding as a direct main_content entry; the validator applies every reuse rule at both levels.",
                  "items": {
                    "type": "object",
                    "properties": {
                      "reuse": {
                        "type": "object",
                        "description": "Same existing-asset binding as at the top level, for a region nested inside a group.",
                        "properties": {"block": {"type": "string"}}
                      }
                    }
                  }
                }
              }
            }
          }
        }
      }
    },
    "icon_mapping": {
      "type": "array",
      "items": {"type": "object", "required": ["role", "outsystems_icon"]}
    },
    "roles": {
      "type": "array",
      "items": {"type": "object", "required": ["name", "description"]}
    },
    "acceptance_checklist": {"type": "array", "items": {"type": "string"}, "description": "Advisory, human-facing prose only. NOT authoritative: main_content is the source of truth. Any count that must be enforced belongs in a screen's optional `assertions` object, which the validator recomputes from main_content."}
  }
}
